{
  "inventory_version": 2,
  "project": "applied-practical-thinking",
  "purpose": "Public Applied Practical Thinking portfolio, learning, demonstration, and publication platform.",
  "description": "A pnpm monorepo containing a Vite and React public website, a separately deployed Cloudflare Worker API and AI subsystem, shared UI/config/knowledge packages, authored public content, and generators that publish an explicitly selected subset of canonical APT doctrine from the sibling apt-principles-agents repository.",
  "audience": [
    "public APT learners",
    "builders and architects",
    "product and design teams",
    "prospective collaborators and employers",
    "APT maintainers and content authors"
  ],
  "adoption_mode": "showcase",
  "principles_demonstrated": ["thinking", "design", "architecture", "execution", "documentation", "knowledge-system", "ai-agent-framework"],
  "repository_type": "monorepo",
  "ownership": {
    "owner": "APT",
    "profile_maintainer": "Applied Practical Thinking maintainers"
  },
  "architecture": {
    "summary": "A browser application and Worker backend share workspace packages and publication contracts; authored product content and selected sibling doctrine are transformed into generated runtime assets for the public site.",
    "components": [
      "apps/web provides the Vite, React, and TypeScript public experience, routes, authored content, design doctrine, publication generators, and validation scripts.",
      "apps/worker provides the Hono-based Cloudflare Worker API, public feed assembly, AI and vector-search boundaries, and normalized content delivery.",
      "packages/ui, packages/config, and packages/knowledge provide shared presentation, token/config, and content/domain contracts.",
      "apps/web/scripts generates indexes, validation evidence, copied runtime content, and the curated public APT doctrine projection.",
      "apt-principles-agents remains canonical for reusable APT doctrine and agent assets; this repository owns its product implementation, public narrative, local exceptions, and deployment configuration."
    ],
    "runtime_model": "The web app runs in the browser from a Vite development or production bundle. The Cloudflare Worker runs independently at the API boundary and accesses Pages-hosted public assets plus a remote Vectorize index.",
    "deployment_model": "Cloudflare Pages builds and serves apps/web from GitHub updates. apps/worker is deployed separately with Wrangler and GitHub Actions; the web and Worker communicate through an explicit VITE_API_BASE and PUBLIC_SITE_ORIGIN contract."
  },
  "runtime": {
    "summary": "Install the pnpm workspace, run the Vite web application and Wrangler Worker independently, generate publication assets before web builds, and deploy the two Cloudflare surfaces separately.",
    "requirements": [
      {
        "name": "Node.js",
        "declared": "No engines field is declared in the root package.json",
        "recommended": "Node.js 20 or newer",
        "verified_by": "README.md; package.json"
      },
      {
        "name": "pnpm",
        "declared": "pnpm-workspace.yaml and pnpm-lock.yaml define the workspace",
        "recommended": "Use Corepack-managed pnpm consistently with the committed lockfile",
        "verified_by": "pnpm-workspace.yaml; pnpm-lock.yaml; package.json"
      },
      {
        "name": "Cloudflare configuration",
        "declared": "Worker compatibility date 2026-01-25 with a remote Vectorize binding",
        "recommended": "Set VITE_API_BASE for Pages and PUBLIC_SITE_ORIGIN for the Worker before production deployment",
        "verified_by": "apps/worker/wrangler.toml; README.md"
      }
    ],
    "package_manager": "pnpm workspace commands at the repository root delegate to apps/web and apps/worker.",
    "local_server": "pnpm dev starts the generated-and-validated Vite web experience; pnpm dev:worker starts the Cloudflare Worker separately.",
    "build": "pnpm build runs configuration checks, APT public-doctrine generation, validation reporting, content-index generation, public-copy generation, and the Vite production build.",
    "deployment": "Cloudflare Pages deploys the web output from GitHub builds; pnpm deploy:worker publishes the Worker through Wrangler."
  },
  "local_cloudflare": {
    "status": "Blocked. Blueprint: [docs/plans/local-cloudflare.md](plans/local-cloudflare.md).",
    "local_command": "`pnpm dev` starts Vite on port 8080 and proxies `/api` to `127.0.0.1:8787`. `pnpm dev:worker` starts the Worker.",
    "fix": "`apps/worker/wrangler.toml` sets Vectorize `remote = true`, so `pnpm dev:worker` fails while creating a remote preview session and the web app has no local Worker. Add a local Wrangler env without that remote Vectorize binding, then run the web app and Worker together. Local Worker requests must read the local Pages origin, not `PUBLIC_SITE_ORIGIN` (`https://appliedpracticalthinking.com`)."
  },
  "commands": [
    {"name": "Repository completion gate", "category": "validate", "command": "pnpm check", "purpose": "Run APT conformance, the design check, lint, typecheck, tests and the production build in order.", "mutates": true, "applicability": "applicable"},
    {"name": "Typecheck", "category": "validate", "command": "pnpm typecheck", "purpose": "Typecheck the Worker and the shared UI package.", "mutates": false, "applicability": "applicable"},
    {
      "name": "Install workspace dependencies",
      "category": "setup",
      "command": "pnpm install",
      "purpose": "Install the root workspace and application dependencies from the committed lockfile.",
      "mutates": true,
      "applicability": "applicable"
    },
    {
      "name": "Run public web application",
      "category": "run",
      "command": "pnpm dev",
      "purpose": "Generate public APT assets and indexes, write validation evidence, copy runtime content, and start Vite.",
      "mutates": true,
      "applicability": "applicable"
    },
    {
      "name": "Run Worker locally",
      "category": "run",
      "command": "pnpm dev:worker",
      "purpose": "Start the Cloudflare Worker development runtime through Wrangler.",
      "mutates": true,
      "applicability": "applicable"
    },
    {
      "name": "Build public web application",
      "category": "build",
      "command": "pnpm build",
      "purpose": "Run web configuration and publication generators, then produce the Vite production bundle.",
      "mutates": true,
      "applicability": "applicable"
    },
    {
      "name": "Web test suite",
      "category": "test",
      "command": "pnpm test",
      "purpose": "Run APT publication contract tests and the Vitest suite.",
      "mutates": false,
      "applicability": "applicable"
    },
    {
      "name": "Web lint and documentation governance",
      "category": "validate",
      "command": "pnpm lint",
      "purpose": "Run ESLint and the documentation validation-report governance gate.",
      "mutates": true,
      "applicability": "applicable"
    },
    {
      "name": "APT conformance validation",
      "category": "validate",
      "command": "pnpm validate:apt-conformance",
      "purpose": "Verify required root APT surfaces and generate the web validation report.",
      "mutates": true,
      "applicability": "applicable"
    },
    {
      "name": "Generate curated public APT doctrine",
      "category": "generate",
      "command": "pnpm --dir apps/web run generate-apt-principles-agents-public",
      "purpose": "Generate the approved public doctrine projection from apt-principles-agents publication and taxonomy contracts.",
      "mutates": true,
      "applicability": "applicable"
    },
    {
      "name": "Generate validation evidence",
      "category": "generate",
      "command": "pnpm --dir apps/web run validation-report:full",
      "purpose": "Write full internal validation evidence and public-safe validation projections.",
      "mutates": true,
      "applicability": "applicable"
    },
    {
      "name": "Generate and copy public content",
      "category": "generate",
      "command": "pnpm --dir apps/web run build-content-index && pnpm --dir apps/web run copy-content-to-public",
      "purpose": "Build content indexes and copy authored content and governed documentation into runtime public directories.",
      "mutates": true,
      "applicability": "applicable"
    },
    {
      "name": "Deploy Worker",
      "category": "deploy",
      "command": "pnpm deploy:worker",
      "purpose": "Publish apps/worker using its Wrangler configuration.",
      "mutates": true,
      "applicability": "applicable"
    },
    {
      "name": "Deploy web application",
      "category": "deploy",
      "command": "",
      "purpose": "Cloudflare Pages deploys the web application automatically from the connected GitHub repository; there is no repository-owned manual deploy script.",
      "mutates": false,
      "applicability": "applicable"
    },
    {
      "name": "Distribute reusable APT assets",
      "category": "distribute",
      "command": "",
      "purpose": "Not applicable; reusable doctrine and managed-asset distribution are owned by apt-principles-agents.",
      "mutates": false,
      "applicability": "not-applicable"
    }
  ],
  "structure": [
    {"path": "apps/web/", "purpose": "Public React application, authored public content, design doctrine, publication scripts, and web validation.", "authority": "canonical", "maintenance": "mixed"},
    {"path": "apps/web/public/", "purpose": "Generated runtime copies of public content, documentation, data, and curated APT doctrine.", "authority": "generated", "maintenance": "generated"},
    {"path": "apps/worker/", "purpose": "Cloudflare Worker API, AI/vector boundaries, feed assembly, runtime configuration, and deployment surface.", "authority": "canonical", "maintenance": "authored"},